{
  "paper_id": "asiep-paper-v0.2",
  "paper_version": "0.2.0",
  "profile": "ASIEP",
  "profile_version": "0.1.0",
  "created_at": "2026-05-05T00:00:00Z",
  "claim_citations": [
    {
      "claim_id": "C1",
      "claim_text": "ASIEP treats self-improvement as an evidence object rather than a new self-improvement algorithm.",
      "required_citation": true,
      "citation_keys": ["self_refine_2023", "reflexion_2023", "voyager_2023", "agentdevel_2026"],
      "source_ids": ["self_refine_2023", "reflexion_2023", "voyager_2023", "agentdevel_2026"],
      "support_level": "indirect",
      "quote_or_paraphrase": "paraphrase",
      "max_quote_words": 0,
      "citation_status": "ready",
      "notes": "Sources establish nearby self-improvement methods; repository evidence establishes ASIEP's evidence-object design."
    },
    {
      "claim_id": "C2",
      "claim_text": "ASIEP uses reference plus digest plus access-policy design instead of embedding raw traces by default.",
      "required_citation": true,
      "citation_keys": ["slsa_provenance_v1_1", "workflow_run_rocrate", "process_run_crate"],
      "source_ids": ["slsa_provenance_v1_1", "workflow_run_rocrate", "process_run_crate"],
      "support_level": "background",
      "quote_or_paraphrase": "paraphrase",
      "max_quote_words": 0,
      "citation_status": "ready",
      "notes": "External sources support provenance and packaging patterns; ASIEP implementation evidence remains repository-local."
    },
    {
      "claim_id": "C3",
      "claim_text": "The repository implements validator, repairer, resolver, importer, packager, and evaluator components.",
      "required_citation": false,
      "citation_keys": [],
      "source_ids": [],
      "support_level": "direct",
      "quote_or_paraphrase": "no_direct_text",
      "max_quote_words": 0,
      "citation_status": "ready",
      "notes": "Implementation claim is supported by repository paths and tests, not external sources."
    },
    {
      "claim_id": "C4",
      "claim_text": "profile.json is the agent-readable entrypoint for discovering ASIEP v0.1 capabilities.",
      "required_citation": false,
      "citation_keys": [],
      "source_ids": [],
      "support_level": "direct",
      "quote_or_paraphrase": "no_direct_text",
      "max_quote_words": 0,
      "citation_status": "ready",
      "notes": "Repository-local implementation claim."
    },
    {
      "claim_id": "C5",
      "claim_text": "The M6 evaluation reports eight metrics.",
      "required_citation": false,
      "citation_keys": [],
      "source_ids": [],
      "support_level": "direct",
      "quote_or_paraphrase": "no_direct_text",
      "max_quote_words": 0,
      "citation_status": "ready",
      "notes": "Metric claim is supported by reports/asiep_v0.1_evaluation_report.json."
    },
    {
      "claim_id": "C6",
      "claim_text": "Local attack corpus detection recall is 1.0 in the M6 report.",
      "required_citation": true,
      "citation_keys": ["owasp_llm_top10"],
      "source_ids": ["owasp_llm_top10"],
      "support_level": "background",
      "quote_or_paraphrase": "paraphrase",
      "max_quote_words": 0,
      "citation_status": "ready",
      "notes": "The numeric result is repository-local; OWASP is cited only as security threat background."
    },
    {
      "claim_id": "C7",
      "claim_text": "False positive rate on known valid local fixtures is 0.0 in the M6 report.",
      "required_citation": false,
      "citation_keys": [],
      "source_ids": [],
      "support_level": "direct",
      "quote_or_paraphrase": "no_direct_text",
      "max_quote_words": 0,
      "citation_status": "ready",
      "notes": "The numeric result is repository-local and must not be described as a general benchmark."
    },
    {
      "claim_id": "C8",
      "claim_text": "Cross-standard coverage is reported as a local minimal mapping, not external validation.",
      "required_citation": true,
      "citation_keys": ["otel_genai_semconv", "w3c_prov_dm", "workflow_run_rocrate", "fdo_architecture_spec", "eu_ai_act_article_12"],
      "source_ids": ["otel_genai_semconv", "w3c_prov_dm", "workflow_run_rocrate", "fdo_architecture_spec", "eu_ai_act_article_12"],
      "support_level": "indirect",
      "quote_or_paraphrase": "paraphrase",
      "max_quote_words": 0,
      "citation_status": "ready",
      "notes": "External standards and documentation define target concepts; ASIEP crosswalk coverage is local matrix coverage, not certification."
    },
    {
      "claim_id": "C9",
      "claim_text": "ASIEP maps to PROV, OTel-like, LangSmith-like, FDO-like, and RO-Crate-like structures with explicit lossiness.",
      "required_citation": true,
      "citation_keys": ["w3c_prov_dm", "w3c_prov_o", "otel_genai_semconv", "otel_genai_agent_spans", "langsmith_observability_concepts", "langsmith_feedback_docs", "fdo_architecture_spec", "workflow_run_rocrate", "process_run_crate"],
      "source_ids": ["w3c_prov_dm", "w3c_prov_o", "otel_genai_semconv", "otel_genai_agent_spans", "langsmith_observability_concepts", "langsmith_feedback_docs", "fdo_architecture_spec", "workflow_run_rocrate", "process_run_crate"],
      "support_level": "direct",
      "quote_or_paraphrase": "paraphrase",
      "max_quote_words": 0,
      "citation_status": "ready",
      "notes": "External sources support target structures; repository crosswalk records explicit lossiness."
    },
    {
      "claim_id": "C10",
      "claim_text": "The current implementation is local-fixture only.",
      "required_citation": false,
      "citation_keys": [],
      "source_ids": [],
      "support_level": "direct",
      "quote_or_paraphrase": "no_direct_text",
      "max_quote_words": 0,
      "citation_status": "ready",
      "notes": "Limitation claim is repository-local."
    },
    {
      "claim_id": "C11",
      "claim_text": "Current privacy compliance uses sentinel and key scanning, not full DLP.",
      "required_citation": true,
      "citation_keys": ["owasp_llm_top10"],
      "source_ids": ["owasp_llm_top10"],
      "support_level": "background",
      "quote_or_paraphrase": "paraphrase",
      "max_quote_words": 0,
      "citation_status": "ready",
      "notes": "Repository evidence supports the privacy limitation; OWASP is security background."
    },
    {
      "claim_id": "C12",
      "claim_text": "Current FDO and RO-Crate outputs are local-like packages, not external certification.",
      "required_citation": true,
      "citation_keys": ["fdo_architecture_spec", "workflow_run_rocrate", "process_run_crate"],
      "source_ids": ["fdo_architecture_spec", "workflow_run_rocrate", "process_run_crate"],
      "support_level": "direct",
      "quote_or_paraphrase": "paraphrase",
      "max_quote_words": 0,
      "citation_status": "ready",
      "notes": "External sources define the target ecosystems; repository docs state ASIEP output is local-like only."
    },
    {
      "claim_id": "C13",
      "claim_text": "ASIEP is complementary to AgentDevel-style release engineering rather than a replacement.",
      "required_citation": true,
      "citation_keys": ["agentdevel_2026", "self_refine_2023", "reflexion_2023", "voyager_2023", "nist_ai_agent_standards", "eu_ai_act_article_72", "slsa_provenance_v1_1"],
      "source_ids": ["agentdevel_2026", "self_refine_2023", "reflexion_2023", "voyager_2023", "nist_ai_agent_standards", "eu_ai_act_article_72", "slsa_provenance_v1_1"],
      "support_level": "direct",
      "quote_or_paraphrase": "paraphrase",
      "max_quote_words": 0,
      "citation_status": "ready",
      "notes": "AgentDevel is the closest nearby work; NIST, EU AI Act, and SLSA are used as motivation and analogy, not ASIEP adoption evidence."
    }
  ]
}
